Review	Liked
Writing a review after   days of very light usage. The phone does as advertised.Pros . Call quality Excellent. A phone is a phone after all and I like the voice clarity in this phone. . Apps  no crashes . Transfer of data from old phone Done with no trouble with Smart Switch. Whatsapp data transfer was quick with  G network. . Screen Brightness good for outdoors . Battery still     remaining after first charging   days ago.Cons . The screen does not go completely black as in AMOLED displays. . The  G is at best a experimental network. Jio says unlimited  g. I have seen download speed upto     Mbps but uplaod speed is less than   Mbps  but the main problem is not speed. The battery starts to drain like anything once I connect to  g network say    in about   minutes while updating aps in playstotre. Please read the article  Samsung phone battery drains quickly on  G service. This is true for any  G phone. Also the phone warms up during connecting to  G network and heavy downloading. So I have kept the power saving switch on and switch it off when I need to connect to  g services. . Bloatwares are holding on tightly. I will have to find ways to eradicate them.Overall I find this phone working nicely  so   Stars. Bought it for Rs  99.	1
One demerit of the phone is heating.Even very low usage of data on only gets heated.Except that everything is good.	1
This I a good phone can t say value for money but it s OK serves the purpose of office use	1
There is no more option in camera.	1
Average features. Wrongly hyped. Don t pay more buy in extreme discount or sale only. Not worth price mentioned.	1
From the first day battery is draining fast.   battery is drained with few hours of usage	1
on that price  you can takefront camera quality is not so good  especially in low light	1
It s a gem at its price point. Go for it blindly. It will never dissatisfy you at this price bracket. What phone Audio  Display  Camera  Battery. Only one con   Samsung should provide charger and case inside the box.	1
The phone is superior in all aspects. I highly recommend buying a screen protector and case along with the phone  even though it has gorilla glass  . It runs One UI core  .  even then it has many features. Also if you are confused between M   and F   lemme tell you that both of them are exactly the same with the only difference being that M   has an extra camera which isn t much useful if you ask me.	1
TRY BUYING M    GB VARIANT FOR PERFORMANCE REASONS.Pros  Good  g connectivity.    Battery is goodstill can not work for straight   days without charging  .Screen size and display quality is very good.Ice silver color is cool design.Ui looks so good.Works smothly for normal task but gaming heats the phone.Best result of camera in daylight photos and videowith stability.Cons Camera is average qualityin low light or at night time.Does not have screen recording and speed meter feature.No three finger screenshot.Takes   . hr to fully charge.Heating while gaming.	1
I love samsung mobiles. Samsung never disappointed me anytime. I am samsung user for last   year. When I am looking to upgrade my mobile to  g. I have choosen this mobile and purchased       with no cost emi on sale. Using last month I doesnot find any issue.	1
First of all I used this device for business purposes  Battery is best part of it almost   days still    remaining  I use whatsapp  youtube  Google Chrome  calls and sometimes camera. All this work like a charm.Look and Display are very nice  Display is big enough for your daily work and to keep in your pocket. camera is batter then other Chinese variants  it has gorilla Glass protection and no IP protection means you need to protect it from water splash.Battery In whole night only use     no bloatware  clean os  not any false battery draining.I used Jio  G works like butter in Mumbai.Used this phone for   days there is no lag I found in any software  software opening is fast.Overall it s best phone for day to day life work and business purposes. I have   GB variant.Again thanks to samsung for providing this marvel for such a budget cost.Amazon delivery is fast delivered on second Day.	1
It s too much heating within few minutes of use	1
Phone started restarting after vey days of usage	1
Battery is good bus camera picture quality is not good	1
Everythings perfect as per the value.Just the charging is too slow	1
At this range not bad.	1
Ok	1
  day battery in normal use   samsung quality and smoothness of software  no bloatware like some other phones   phone works very fast  fast charging works very good with  W apple i pad charger.	1
It s up to date. Large screen. Higher storage capacity. Higher capacity RAM.  G. Habituated to using Samsung and hence the confidence on the product.	1
Play Video	1
Good phone in its category in budget segment. Special highlight is it s monster battery Above average camera and ok type performance. This phone is not for a gamer photographer because it can provide you everything in its limit. Never compare it with Galaxy S   Ultra or iPhone    like performance and feature. It is just like comparing Alto with BMW or Ferrari. Where Alto is best known for its mileage this phone is best for its battery endurance.I have bought this for my father and very happy to say that it suites for him for his daily needs. If you are a normal user then go for it without any doubt.	1
I like the color of the mobile. As expected  the battery standby is good. It is suitable for long time users.	1
Disappointed as it s Thik in size and slow in performance as same as all Samsung phones.I just preferred because it s non China Phone and its UI.	1
Awesome mobile from Samsung. In this price it s a good package  specially for the people  who don t want any Chinese phone. SOFTWARE is a big highlight of this smartphone. In addition it powered with   mah battery. Though  G is not stable  it s providing better connectivity than other  G phones. Overall it s a excellent Experience.	1
Camera quality is awesome  display is awesome  speaker is average  connectivity is awesome  overall good phone	1
Great phone at this price  awesome battery backup  little camera bump  nice weight distribution.With    watt charger it takes almost    mins to charge  to   .Also it has   nos.  G sim slot with micro SD card support and  .  mm head phone jack.Overall good phone for normal day to day uses with awesome battery backup.Its battery protection feature I like most.	1
Phone without charger	1
Good phone at this price. Not so great as per the hype created before launching the phone.	1
The phone is good in all respect. There is nothing to dislike. It is value for money	1
It  frequently got stucked while working. Want to return	1
Good Quality Samsung Galaxy M     G  GB    GB Like   	1
Camera  Battery  Made Quality   New feature  noise cancellation  during call are bestProcessor is only for normal use not for heavy use somewhere found laggy Processor during useWeight is some more because   mah battery Adapter not included  and if the only cable provide that is also worst because that is also C to C and C type Adapter are more costly	1
Expected more from Samsung.At least Screen Gurad and Protective Case were must have provided.	1
I have been using since   week and good performance and battery backup also good. Camera decent pictures okay for now.Processor also making speed performance no lag as of now.I think it s good fit for parents.For youngsters  it might be difficult to operate more apps in this.For normal usage  it s best and good phone at this prize. G  normal games  no lag  no hear issues  more hours battery backup    days  internet speed and connectivity good.Overall Good and Best and Nice phone in this budgetMy price      9	1
In this price range. Best  g phone...Completely worth of money..	1
Very good phone. Battery performance is very good	1
Beautiful color  picture quality is very good....almost everything thing is very good...	1
Sab Kuchh OK    hain main bahut hi Khush hun  G phone superfast charge oh my god I am so happy thank you Amazon thank you   	1
Excellent mobile with good features and affordable price. Recommend to buy.	1
GOOD MOBILE. VALUE FOR MONEY.  G WORKING NICELY.	1
Good product in this price rangeI have purchased during sale period I got this product in     with some card discount including chargerMobile is little heavy but weight distribution is goodThis is good for aged populationsCamera performance is decent and User interface is good it s not completely clean but we can uninstall the unwanted applicationsDisplay is awesome 9 hz full hd plus with gorilla glass protectionBattery life is good	1
For budget phone it worth it	1
Good for the price.... Offers so many things for   99 Rs. Using from   days. No issues faced...	1
Product is as described	1
This I bought  gb ram for     9 after    cash back offer it s a good phone on this budget previously I bought oppo f   pro and for my spare purpose only I bought this phone which is very good no lagging  no software issues no heating problems I would recommend to buy this product thank you Amazon team	1
The phone is good at specs  but bad at performance. I upgraded my M   to this by exchange  but disappointed as my previous phone was far better in UI and Speed. The android    sucks big time with samsung one UI and i am sad to see most of the camera features gone single shot  hyperlase  slow motion etc along with many other essential settings. The display is crisp but uncontrollable as far as contrast adjustment. No always on display option available  so you will never know whether the phone is charging or not when connected to charger. The UI is pretty bad.  G is just okay  nothing greater than  G now  so cant say much abt that. Camera in full resolution takes about   seconds for a picture to be saved after clicking  this is a serious issue. Overall  the worst M series ever released by samsung.	0
Nice looking	1
I didn t like camera quality	1
Very nice	1
Very good product	1
Good quality	1
For watching Youtube	1
Good product	1
Nice	1
Nice	1
Nice phone	1
I recently bought this Samsung M   and I love it  The phone is a great value for the price and has fast and reliable  G connectivity. The camera is excellent and the battery life is impressive. I would definitely recommend this phone to anyone looking for a high quality  G phone at an affordable price.	1
Good and genuine product made by Samsung. It s worth a penny	1
Good in condition  but my name change in Amazon account  I m Mohan Lal  not Mohammad	1
I got the  GB    GB piece along with bank discount for    9. In that price range it is amazing with long battery life  lot of  g bands available  decent camera and good performance. If you are just a casual gamer or want to buy for your parents this is the best choice in this price comparing with others availabe in the market now.	1
Good	1
Very good configuration in   k	1
This is a Gem Product From Samsung. I liked it a Lot. Its very Sturdy. Picture quality is good. Sound Quality is also good. All in all A good Budget  g Phone.	1
THE he phone is good overall....if it has the on screen fingerprint sensor it is the best phone in that price range....one of the best phones I ve ever used   ....It gives you a whole day battery with a single charge....The phone in hand feel is good....Performance is first class....TRIPPELE camera  MG pixel awesome....that the phone is awesomeeeee..........	1
After using the phone for a month  I m giving it a review. for the  G affordable class  nice mobile. Both the front and back cameras are excellent. It s just value for money.	1
Worth for cost	1
All my works completed without delay Fast.	1
 G    bands with  mah big battery and screen.Also latest Android   .	1
This phone is pretty good with a decent priceYou can go for it   	1
In my hands this m    g was working good.I purchased  gb ram    gb storage model.Using samsung   w adapter charging takes   to    mins.No lagging issues and no heat issues noted in   days period.Battery was good.Camara quality also good in this budget.Network speed  voice call focus mode and call Quality also good.But this is not having stereo spekers.Lcd Display  some members dislikes this Display  but in this budget nice Display.Overall i give     rating.	1
The Samsung M   is a great mid range phone for anyone on a budget. It has all the features you need  including a great camera  plenty of storage space  and a fast processor. Plus  the sleek design looks and feels premium. I would definitely recommend this phone to anyone looking for a solid device without breaking the bank.	1
Everything is perfect like price  display  battery etc. Perfect product. I recommend it.	1
Good	1
Looks amazing and working very well	1
Its very good for budget  g	1
Nice budget phone in a price tag of   k.	1
I m using this phone past   days and it s an amazing phone. NO LAG  Good Camera  Fast fingerprint  awesome performance. I don t know why people are writing so bad reviews.I was using Galaxy M   before this and yeah Galaxy M   is faster  better and battery really last for   whole days  Those who are saying camera is not good see these pics.Amazing Mobile	1
Good performance and display.Camera both front and back takes great pictures.Battery life is also good  will sustain for approx.   days using it for one week now and charged the phone thrice.Unfortunately  no charging adapter is included which I believe should have been included.Overall  satisfied with the phone and it s features as well.	1
Best in budget	1
Android    and one UI  .  Version Nice combination Samsung Brand is very nice compare to chaines brand so go and buy this phone	1
Good Budget Cellphone	1
Camera is good  Battery  mAH but drain fast.	1
Overall performance was Okay for this segment Underrated Gem    Exynos      .  GhzUnbelievable price segmentProsExynos     processor under   k    G band support  yrs OS     yrs Security update    Mah batteryOne ui  .  is okstock recommended   Expect the unexpected  ConsVery very slow charging     W  almost     WAsusual no adapter included in BoxNot recommended for gaming butE    SD    9 	1
Sab log le lo mobile bahut shi hai battery backup aur smoothness gazb hai	1
Best quality mobile phone . I found nothing negative in this M   . Bindaas kharido ....	1
Good quality safe deliver	1
Phone s camera is so good .	1
I just bought the M    g variant in white colour. Overall an excellent phone in terms of specs and usage.The only downside I felt was the speaker volume but its manageable  and the phone feels real heavy.But certainly a good buy at this price.	1
Play Video Excellent condition namaste                     	1
Good product   	1
I am absolutely in love with my Samsung M    The battery life lasts all day and the camera takes stunning photos. The phone itself feels sturdy and well made  and the display is crystal clear. I would highly recommend this phone to anyone looking for a high quality device at an affordable price point.	1
good phone camera was good rear and front both are good.Batter excellent   day sure .Screen super amoled amoled high brightness indoor or outdoor it s more light .Performace good gamming phoneI love camera  music and video these          	1
Delivered phone in less than    hours. Great phone with great features. Loved it.	1
I bought it for my mum... It is good	1
Smooth and good interface with good Batter life... good for day to day life usage.	1
I purchased this phone via Amazon and following are my observations   . Most of the time phone doesn t select  G network  it remains on  G network  although the company claims it to be fully  G compatible. . Dedicated slot i.e memory slot plus sim card slot has serious issue with memory card detection. Most of the time this phone doesn t detect a memory card and again and again you have to do restart for memory card detection. . If you perform     task at a time  phone gets quite heat up. . Battery life is not that spectacular considering  mAH and RAM management is also not good.	0
Very nice.	1
One of the Best Budget  G Smartphone with Decent Cameras  Strong Battery  Best Android Skin. Only thing u have to remember is to Purchase   Watts Samsung Charger which costs u around 9 to   .	1
Samsung is best in Android category	1
All is well to be with  g.	1
It s okay to use as a secondary device and budget wise it justified for it s price. Those who wants samsung brand it will be good choice in budget and usable phone for   years atleast. rest choice	1
I saw that some people said that its hanging  its heating etc. But bhai sahab jo log samsung phone use karte hai unke liye ye  g phone sanjiwani hai. Koi problem nhi koi heating issue nhi hai   bindas le lo samsung brand hai bhai . Ha agar aap samsung ka original   w charger use karte ho tb.Main is mobile ko   star deta hu.	1
Phone is superb. For low and medium usage. I you are serious and taking photos or gaming there are other alternatives to this.	1
Thnx you samsung	1
Best Quality Product   	1
The phone has a very sleek and Aesthetic design and has good specs and the company has the value of moneyOverall the product is very good	1
You can buy this phone blindly  good features  good configuration     band  g support  what else u need	1
This is a Nice ProductHaving Good FeaturesAt such low costSo affordable  I m loving it	1
Good   	1
Excellent mid budget phoneProcessor  it s working very fine without any lag.Battery  it s last a couples of the dayDesign  it looks premium phoneDisplay  very fine  and of course corning gorilla glass.Camera   Very Good.This phone is value for money	1
Go for it if you want really great battery backup. Phone is great otherwise also considering the price point	1
The Samsung galaxy m   is a value for money phone under this price point.	1
Good mobile for this cost	1
Good delivery service  good packaging service  overall good experience. Nice product...	1
Review it after using it for    days And it s waste of money as no return available only replacement is available can get better mobile in the same bugged.   Back camera is useless and of very bad quality.   Samsung keyboard do not have all the required settings have to download google keyboard.    G takes time to connect to the internet.e.t.c    Battery is of  Mah but drain very fast and gives feel that it is only about  mah kind of something.   The processor speed is    good very fast.But i think Samsung could have done better with this mobile. Very disappointedI am wishing should have bought Samsung F   instead of this garbage.	0
awesome     	1
Super	1
at this price range you are getting an  GB      GB combination which is one of the best phones that I have ever bought. As per the performance the camera output is amazing with  MP with in built AI. The battery is good.        	1
it is a nice product u can definitely choose itThe camera is very goodThe performance is goodFast charging sportValue for moneyThe  G best product	1
I am a preowner of mid range phone Realme X . I started using M    GB version last week. Until now I don t have any problem in places where I used X . But when I use my new phone  call drops frequently  Apps will display no internet  I have to restart to get internet. It s becoming a nightmare for me. Video streaming struggles eventhough I have    GB of jio data left.I thought the monster battery will last for two days but it will last for one day.I bought this phone after comparing specs  and realised how I fooled myself out	0
The phones notch design makes it feel dated plus the   mah battery makes it little heavy as well.Performance wise the phone is OK but not supper snappy.If you have already used a  gb Ram phone then this phone feels super slow .Regular browsing and other stuffs can be managed quite easily and battery back up is great as well.Phone is suited for people above   who don t expect stylish looking or high end gaming Performance but they just want decent camera and regular browsing experience.Kindly do not buy if you re already used to super fast mobiles .	0
Battery back up awesomeDisplay is very goodEverything is fine but their is no charging indication light in this phoneCharging time it s take  .  hrs super fast chargeBuyed charger at samsung storeGot it for   	1
I purchased this phone on the day it was launched and I found defects on the display and the phone was defective. Defective because the portion below the sim slot on the left hand side made clicking sound when pressed which means the case is little bigger than the phone. I returned the phone and the new phone also came with the same defect but now on the right hand side below the fingerprint sensor. I m returning it again. Only good thing is the battery but if it comes with a defect then what s the point  Also when you are spending   more for the charger. Highly disappointed.	0
very good mobile	1
This mobile delivered yesterday its camera superb  running fast  camera quality good  battery backup also good all specifications good... please purchase this product	1
I bought a  gb Ram phone new model phone      though it s performance and graphics does compare to phone of spec from   years back. Very disappointed to buy a    phone.The battery is good for a new though  not sure it will be in future.	0
This is best  g phone in low price segmentSound is goodCamera is goodFingerprint works smoothlyCharging speed ok with logal chargerBut it s works like blast with original    watt charger	1
Acha phone hai    me	1
DISPLAY   STAR. SOFTWARE GOOD SMOOTH AND LOCK FACTION GOOD COLOUR AND BRITNESS IS GOOD.	1
value for money	1
Nice look	1
The phone is overall good . Camera is overall quite and video is stable if you want to vlog . The UI interface needed to be improve . You can go for it      	1
The only pros of buying this phone was I availed it with    HDFC Instant discount and No cost EMI and the phone was delivered within    hours of order.Cons  . The battery is same like I used my A s. I don t see any difference with monster battery. . Touch is not working sometimes when we need to attend the incoming call. . When holding the edge and touching the centre of the screen phone starts to flickering. . Case and temporary screen protector is not provided. . No power adaptor and headphones.	0
It is not value for money if you buy it without discount. But if you love samsung ui and their software updates then go for it  cause in hardware there are nothing special in this phone  just usual stuff that a   k phone should have. About  G connection  it is seamless.	1
Good phone	1
If you want to buy  g phone in mid budget Go for Samsung m   without hesitationBecause you can t find good  g phone  price of      Battery backup is excellentCamera and sound is fineDisplay is good though it is LCD	1
Product is good. No issue in product.I ordered product on    th April price      after card discount price   .As product delivered they have reduced price    after discount     .Now I have check on  may    . Samsung F   price on same as m  . is    after card discount. So wisely choose the product before purchasing.	1
Design and display are excellent  tripple  mp pixel camera is very good. Dolby sound excellent I love it and gaming is awesome. Battery up also good. It s a allrounder phone	1
Best phone in this range	1
Battery is one day only  phone is no heat	1
One word I want to say about this smartphone  awesome 	1
Really good budget phone little bit slow but manageable as per the purchase cost it s a gem	1
I am using M    GB Happy with the product. Nice mobile  better go for   GB varient.	1
Nice phone But Camera quality is Not That Excepted Anyway I just like the phone You Van Buy this	1
Good phone he is come with   mah battery.good Battery backup long lasts for   day Colour is good  display also good.good camera quality.. Sound quality is very good	1
nothing	1
Likes ScreenBattery life gPrice of phoneDislikesSome features from Camera missing.Sometimes scrolling is not smooth.	1
Phone is good I ordered on   st April at     9 but now they have reduced the price by    it feels cheated for the person who ordered on  st Day	1
purchased it for family.very light use only.So for the price range it s awesome.Good built quality and stylish.  mp triple camera does its job excellent...	1
Nice mobile at this budget.Back camera is but front camera should be little bit improved.	1
This mobile is very awsome... Looking good.. And all fecharce is very good	1
It is most amazing phoneI love its cameraThe performance is very good and smooth runningAnd also ONE UI is very lag free.	1
thank you for the product.its a excellent phone with good features.Lap free performance. Very good battery back up.Thank You amazon and it s delivery for quick speed      	1
This mobile phone is very beautiful  looking very good  Fecharc is so much..  camera is awsome	1
Its best budget phone in  gBattery backup is superCharging speed is good with original chargerCamera is goodSound is ok	1
I have purchased samsung M    G last week. Since I m using the main thing is battery backup is very good  performance is awesome  budget friendly mobile. One dispointed me that is no slow motion video option.	1
Good phone	1
Must bye	1
This is the best low budget phone from Samsung.Display quality is super in this range.Mic    quality also Super.Everything is great         Good job Samsung	1
Value for money mobile phone and mobile features	1
Noice battery performance    days with normal usage	1
good display 9hrz refresh rate mah battery   watts fast charger mp camera quilty was superbgo for it   	1
superB .. And super slim and looking fabulous thank you amazon...Osm  G mob. At this range... I love it	1
THE best smartphone right now in the segment. Good camera results and awesome performance. One can go tfor this smartphone without any doubt...	1
